{
  "$schema": "http://json-schema.org/draft-07/schema#",
  "title": "Configuration Schema",
  "type": "object",
  "properties": {
    "general": {
      "type": "object",
      "properties": {
        "prefix": { "type": "string" },
        "adminRole": { "type": "string" },
        "modRole": { "type": "string" },
        "guildId": { "type": "string" }
      },
      "additionalProperties": true
    },
    "entry": {
      "type": "object",
      "properties": {
        "welcomeChannel": { "type": "string" },
        "rulesChannel": { "type": "string" },
        "verificationRole": { "type": "string" },
        "staffRoleId": { 
          "oneOf": [
            { "type": "string" },
            { "type": "array", "items": { "type": "string" } }
          ]
        },
        "memberRoleId": { "type": "string" }
      },
      "additionalProperties": true
    },
    "modmail": {
      "type": "object",
      "properties": {
        "modmailCategory": { "type": "string" },
        "modmailLogs": { "type": "string" },
        "categoryId": { "type": "string" },
        "staffRoleIds": {
          "type": "array",
          "items": { "type": "string" }
        }
      },
      "additionalProperties": true
    },
    "tickets": {
      "type": "object",
      "properties": {
        "ticketCategory": { "type": "string" },
        "supportRole": { "type": "string" },
        "ticketLogs": { "type": "string" },
        "ticketCategoryId": { "type": "string" }
      },
      "additionalProperties": true
    },
    "logging": {
      "type": "object",
      "properties": {
        "modLogs": { "type": "string" },
        "messageLogs": { "type": "string" },
        "voiceLogs": { "type": "string" },
        "memberLogs": { "type": "string" },
        "logChannelId": { "type": "string" },
        "messageLogChannelId": { "type": "string" },
        "voiceLogChannelId": { "type": "string" },
        "roleLogChannelId": { "type": "string" },
        "roleLogs": { "type": "string" }
      },
      "additionalProperties": true
    },
    "welcome": {
      "type": "object",
      "properties": {
        "welcomeMessage": { "type": "string" },
        "rulesMessage": { "type": "string" },
        "welcomeDM": { "type": "string" },
        "welcomeChannels": {
          "type": "object",
          "properties": {
            "welcomeChannelId": { "type": "string" },
            "logChannelId": { "type": "string" },
            "deleteAfter": { "type": "number" },
            "welcomeMessage": { "type": "string" }
          }
        }
      },
      "additionalProperties": true
    },
    "confession": {
      "type": "object",
      "properties": {
        "confessionChannel": { "type": "string" },
        "confessionLogs": { "type": "string" },
        "confessionRole": { "type": "string" },
        "confessionChannelId": { "type": "string" }
      },
      "additionalProperties": true
    },
    "games": {
      "type": "object",
      "properties": {
        "gameChannel": { "type": "string" },
        "dailyQuizChannel": { "type": "string" },
        "gameLeaderboard": { "type": "string" },
        "dailyQuizChannelId": { "type": "string" },
        "quizChannelId": { "type": "string" }
      },
      "additionalProperties": true
    },
    "kink": {
      "type": "object",
      "properties": {
        "nsfwChannel": { "type": "string" },
        "kinkLevels": { "type": "string" },
        "kinkLogs": { "type": "string" }
      },
      "additionalProperties": true
    }
  },
  "additionalProperties": true
}
