{
  "general": {
    "prefix": "!",
    "adminRole": "1337103887697707109",
    "modRole": ""
  },
  "entry": {
    "welcomeChannel": "ID_DU_SALON_ACCUEIL",
    "rulesChannel": "ID_SALON_LOG",
    "verificationRole": "",
    "forbiddenRoleIds": [
      "1379261130995925032"
    ]
  },
  "modmail": {
    "modmailCategory": "1371178119792427179",
    "modmailLogs": "1372227326150185040"
  },
  "tickets": {
    "ticketCategory": "",
    "supportRole": "1371178637570609193",
    "ticketLogs": "1372227326150185040"
  },
    "logging": {
        "modLogs": "1183256994821640203",
        "messageLogs": "1183256994821640203",
        "voiceLogs": "1183256994821640203",
        "memberLogs": "1183256994821640203",
        "roleLogChannelId": "1380253358727888947"
    },
  "welcome": {
    "welcomeMessage": "Bienvenue @user sur notre serveur !",
    "rulesMessage": "",
    "welcomeDM": ""
  },
  "confession": {
    "confessionChannel": "validation_1748835568822"
  },
  "games": {
    "gameChannel": "1377436829145497733",
    "gameLeaderboard": ""
  },
  "kink": {
    "nsfwChannel": "",
    "kinkLevels": "false",
    "kinkLogs": ""
  }
}
